{
  "fixture_version": 1,
  "scene": "textedit_sample",
  "description": "TextEdit 示例：录制模式自测（非 BOSS）",
  "recorded_at": "2026-10-04T11:28:52.404198+00:00",
  "source": {
    "app": "TextEdit",
    "app_version": null,
    "driver": "2ndscreen-cli",
    "recorded_by": null
  },
  "redaction": {
    "names_replaced": true,
    "phones_removed": true,
    "wechat_removed": true,
    "notes": "由 monitor.driver.record 录制：姓名按调用方替换表替换，手机号/微信号/邮箱正则删除；CLI 不输出 enabled，一律记为 true。"
  },
  "steps": [
    {
      "label": "初始",
      "window": {
        "pid": 52468,
        "window_id": 131479,
        "frame": {
          "x": 4800.0,
          "y": 25.0,
          "w": 1280.0,
          "h": 775.0
        },
        "title": "Untitled 2",
        "app_name": "TextEdit"
      },
      "elements": [
        {
          "index": 0,
          "role": "AXWindow/AXStandardWindow",
          "label": "Untitled 2",
          "value": "",
          "frame": {
            "x": 4800.0,
            "y": 25.0,
            "w": 1280.0,
            "h": 775.0
          },
          "enabled": true
        },
        {
          "index": 1,
          "role": "AXTextArea",
          "label": "",
          "value": "sample text [已替换]",
          "frame": {
            "x": 4800.0,
            "y": 113.0,
            "w": 1280.0,
            "h": 687.0
          },
          "enabled": true
        },
        {
          "index": 2,
          "role": "AXRuler",
          "label": "",
          "value": "",
          "frame": {
            "x": 4800.0,
            "y": 81.0,
            "w": 1280.0,
            "h": 32.0
          },
          "enabled": true
        },
        {
          "index": 3,
          "role": "AXMenuButton",
          "label": "¶",
          "value": "",
          "frame": {
            "x": 4807.0,
            "y": 57.0,
            "w": 34.0,
            "h": 20.0
          },
          "enabled": true
        },
        {
          "index": 4,
          "role": "AXPopUpButton",
          "label": "typeface",
          "value": "Helvetica",
          "frame": {
            "x": 4848.0,
            "y": 57.0,
            "w": 100.0,
            "h": 20.0
          },
          "enabled": true
        },
        {
          "index": 5,
          "role": "AXPopUpButton",
          "label": "style",
          "value": "Regular",
          "frame": {
            "x": 4953.0,
            "y": 57.0,
            "w": 100.0,
            "h": 20.0
          },
          "enabled": true
        },
        {
          "index": 6,
          "role": "AXComboBox",
          "label": "font size",
          "value": "12",
          "frame": {
            "x": 5058.0,
            "y": 57.0,
            "w": 45.0,
            "h": 20.0
          },
          "enabled": true
        },
        {
          "index": 7,
          "role": "AXButton",
          "label": "",
          "value": "",
          "frame": {
            "x": 5084.0,
            "y": 57.0,
            "w": 21.0,
            "h": 21.0
          },
          "enabled": true
        },
        {
          "index": 8,
          "role": "AXColorWell",
          "label": "text color",
          "value": "rgb 1 1 1 1",
          "frame": {
            "x": 5110.0,
            "y": 57.0,
            "w": 22.0,
            "h": 20.0
          },
          "enabled": true
        },
        {
          "index": 9,
          "role": "AXButton",
          "label": "",
          "value": "",
          "frame": {
            "x": 5110.0,
            "y": 57.0,
            "w": 22.0,
            "h": 20.0
          },
          "enabled": true
        },
        {
          "index": 10,
          "role": "AXColorWell",
          "label": "text background color",
          "value": "Clear color",
          "frame": {
            "x": 5137.0,
            "y": 57.0,
            "w": 22.0,
            "h": 20.0
          },
          "enabled": true
        },
        {
          "index": 11,
          "role": "AXButton",
          "label": "",
          "value": "",
          "frame": {
            "x": 5137.0,
            "y": 57.0,
            "w": 22.0,
            "h": 20.0
          },
          "enabled": true
        },
        {
          "index": 12,
          "role": "AXGroup",
          "label": "text style",
          "value": "",
          "frame": {
            "x": 5166.0,
            "y": 57.0,
            "w": 64.0,
            "h": 20.0
          },
          "enabled": true
        },
        {
          "index": 13,
          "role": "AXCheckBox/AXSegment",
          "label": "bold",
          "value": "0",
          "frame": {
            "x": 5166.0,
            "y": 57.0,
            "w": 22.0,
            "h": 21.0
          },
          "enabled": true
        },
        {
          "index": 14,
          "role": "AXCheckBox/AXSegment",
          "label": "italic",
          "value": "0",
          "frame": {
            "x": 5188.0,
            "y": 57.0,
            "w": 21.0,
            "h": 21.0
          },
          "enabled": true
        },
        {
          "index": 15,
          "role": "AXCheckBox/AXSegment",
          "label": "underline",
          "value": "0",
          "frame": {
            "x": 5209.0,
            "y": 57.0,
            "w": 21.0,
            "h": 21.0
          },
          "enabled": true
        },
        {
          "index": 16,
          "role": "AXRadioGroup",
          "label": "text alignment",
          "value": "",
          "frame": {
            "x": 5237.0,
            "y": 57.0,
            "w": 85.0,
            "h": 20.0
          },
          "enabled": true
        },
        {
          "index": 17,
          "role": "AXRadioButton/AXSegment",
          "label": "align left",
          "value": "1",
          "frame": {
            "x": 5237.0,
            "y": 57.0,
            "w": 22.0,
            "h": 21.0
          },
          "enabled": true
        },
        {
          "index": 18,
          "role": "AXRadioButton/AXSegment",
          "label": "align center",
          "value": "0",
          "frame": {
            "x": 5259.0,
            "y": 57.0,
            "w": 21.0,
            "h": 21.0
          },
          "enabled": true
        },
        {
          "index": 19,
          "role": "AXRadioButton/AXSegment",
          "label": "align right",
          "value": "0",
          "frame": {
            "x": 5280.0,
            "y": 57.0,
            "w": 21.0,
            "h": 21.0
          },
          "enabled": true
        },
        {
          "index": 20,
          "role": "AXRadioButton/AXSegment",
          "label": "fully justify",
          "value": "0",
          "frame": {
            "x": 5301.0,
            "y": 57.0,
            "w": 21.0,
            "h": 21.0
          },
          "enabled": true
        },
        {
          "index": 21,
          "role": "AXPopUpButton",
          "label": "line spacing",
          "value": "1.0",
          "frame": {
            "x": 5329.0,
            "y": 57.0,
            "w": 41.0,
            "h": 20.0
          },
          "enabled": true
        },
        {
          "index": 22,
          "role": "AXMenuButton",
          "label": "list style",
          "value": "",
          "frame": {
            "x": 5375.0,
            "y": 57.0,
            "w": 41.0,
            "h": 20.0
          },
          "enabled": true
        },
        {
          "index": 23,
          "role": "AXStaticText",
          "label": "",
          "value": "—",
          "frame": {
            "x": 5455.0,
            "y": 29.0,
            "w": 14.0,
            "h": 18.0
          },
          "enabled": true
        },
        {
          "index": 24,
          "role": "AXButton/AXCloseButton",
          "label": "",
          "value": "",
          "frame": {
            "x": 4806.0,
            "y": 31.0,
            "w": 16.0,
            "h": 16.0
          },
          "enabled": true
        },
        {
          "index": 25,
          "role": "AXButton/AXFullScreenButton",
          "label": "this button also has an action to zoom the window",
          "value": "",
          "frame": {
            "x": 4846.0,
            "y": 31.0,
            "w": 16.0,
            "h": 16.0
          },
          "enabled": true
        },
        {
          "index": 26,
          "role": "AXButton/AXMinimizeButton",
          "label": "",
          "value": "",
          "frame": {
            "x": 4826.0,
            "y": 31.0,
            "w": 16.0,
            "h": 16.0
          },
          "enabled": true
        },
        {
          "index": 27,
          "role": "AXMenuButton",
          "label": "Edited",
          "value": "",
          "frame": {
            "x": 5470.0,
            "y": 29.0,
            "w": 55.0,
            "h": 18.0
          },
          "enabled": true
        },
        {
          "index": 28,
          "role": "AXImage",
          "label": "Untitled 2",
          "value": "",
          "frame": {
            "x": 5367.0,
            "y": 29.0,
            "w": 18.0,
            "h": 18.0
          },
          "enabled": true
        },
        {
          "index": 29,
          "role": "AXStaticText",
          "label": "",
          "value": "Untitled 2",
          "frame": {
            "x": 5386.0,
            "y": 30.0,
            "w": 68.0,
            "h": 16.0
          },
          "enabled": true
        }
      ],
      "annotations": {
        "page": "other",
        "notes": "TextEdit 文档窗口"
      }
    },
    {
      "label": "点了斜体之后",
      "window": {
        "pid": 52468,
        "window_id": 131479,
        "frame": {
          "x": 4800.0,
          "y": 25.0,
          "w": 1280.0,
          "h": 775.0
        },
        "title": "Untitled 2",
        "app_name": "TextEdit"
      },
      "elements": [
        {
          "index": 0,